{
  "schema": "nsrl.model_launch_recipe.v1",
  "launch": {
    "id": "integer-transformer-proof-v1-genesis",
    "title": "Integer Transformer Proof v1",
    "summary": "Publish the first NSRL-born integer transformer that strictly beats every frozen next-token baseline.",
    "network": "nsrl-prototype-v1",
    "mode": "specimen",
    "status": "promoted",
    "published_at": "2026-07-13T00:00:00Z"
  },
  "proposer": {
    "account": "nsrl:lab:genesis",
    "bond_units": "25000"
  },
  "participants": {
    "builder": "nsrl:builder:integer-core",
    "compute": "nsrl:compute:graviton-pool",
    "validator": "nsrl:validator:proof-v1",
    "sponsor": "nsrl:sponsor:prototype",
    "treasury": "nsrl:treasury:public-goods"
  },
  "model": {
    "family": "NSRLMT5",
    "artifact_format": "NSRLMT5",
    "architecture_profile": "small-h8-d128-ff256",
    "tokenizer_contract": "byte-v1",
    "parent_model_hash": null,
    "max_artifact_bytes": "600000"
  },
  "source": {
    "repository": "https://github.com/atimics/nsrl",
    "commit": "745e7750bb4cc3d666f5c749e7465afad11cc664",
    "evaluator_sha256": "d8e951c9701dd6c331104bcf85a5164502bf721f2d59ed5b4dda03de6bbd1ff0"
  },
  "dataset": {
    "contract": "integer-transformer-proof-v1",
    "dataset_hash": "0x8fe7b86378f81951",
    "manifest": "benchmarks/integer-transformer-proof-v1/manifest.tsv",
    "heldout_targets": 5896
  },
  "run": {
    "max_compute_units": "4096",
    "compute_unit": "normalized-cpu-unit",
    "stages": [
      {
        "id": "train-candidate",
        "command": "scripts/run-integer-transformer-proof-candidate.sh data/experiments/integer-transformer-proof-v1/candidate-default",
        "compute_units": "3072"
      },
      {
        "id": "evaluate-candidate",
        "command": "cargo run -p nsrl-eval -- check --manifest benchmarks/integer-transformer-proof-v1/manifest.tsv --results data/experiments/integer-transformer-proof-v1/candidate-default/proof-results.tsv",
        "compute_units": "768"
      },
      {
        "id": "freeze-publication",
        "command": "node scripts/freeze-integer-transformer-proof-candidate.mjs --check",
        "compute_units": "256"
      }
    ]
  },
  "bounties": [
    {
      "id": "beat-float-reference",
      "sponsor": "nsrl:sponsor:prototype",
      "escrow_units": "120000",
      "metric": "probability_error_q15",
      "direction": "minimize",
      "baseline": "363650570",
      "target": "350000000",
      "payout": {
        "kind": "linear-with-promotion-bonus",
        "promotion_bonus_bps": 2500
      },
      "guardrails": [
        {
          "metric": "mistakes",
          "operator": "lte",
          "value": "3226"
        },
        {
          "metric": "unique_predicted_tokens",
          "operator": "gte",
          "value": "8"
        },
        {
          "metric": "rejected_batches",
          "operator": "eq",
          "value": "0"
        }
      ]
    }
  ],
  "promotion": {
    "contract": "integer-transformer-proof-v1",
    "checker_command": "cargo run -p nsrl-eval -- check --manifest benchmarks/integer-transformer-proof-v1/manifest.tsv --results data/experiments/integer-transformer-proof-v1/candidate-default/proof-results.tsv",
    "checker_sha256": "d8e951c9701dd6c331104bcf85a5164502bf721f2d59ed5b4dda03de6bbd1ff0",
    "valid_exit_code": 0
  },
  "rewards": {
    "asset": {
      "symbol": "ITP1",
      "name": "Integer Transformer Proof Credits",
      "decimals": 0,
      "max_supply_units": "1000000",
      "transferability": "disabled-v1",
      "utility": [
        "sponsor successor model runs",
        "redeem prototype inference quotas",
        "signal participation without controlling promotion"
      ]
    },
    "emission": {
      "initial_block_reward_units": "32000",
      "halving_interval_blocks": 8,
      "minimum_block_reward_units": "1000",
      "event_multipliers_bps": {
        "launch_published": 2500,
        "stage_accepted": 5000,
        "candidate_valid": 10000,
        "independent_replay": 5000,
        "model_promoted": 20000
      }
    },
    "allocation_bps": {
      "builder": 3000,
      "compute": 3500,
      "validator": 2000,
      "sponsor": 1000,
      "treasury": 500
    }
  },
  "publication": {
    "model_hash": "0x6ffd37de48a3121b",
    "artifact_sha256": "37acae6a4f763182730c76f762c351eda5bb37d6d197358c252733b1f08dca10",
    "artifact_path": "data/experiments/integer-transformer-proof-v1/candidate-default/candidate.nsrlmt",
    "proof_sha256": "f3fddde409aa3d623ee55a5253aad42be2e90b7f2990a7c039437a1c571079d4",
    "metrics": {
      "targets": "5896",
      "mistakes": "2482",
      "probability_error_q15": "260536589",
      "unique_predicted_tokens": "41",
      "most_predicted_token_share_per_mille": "179",
      "rejected_batches": "0"
    }
  }
}
